{"allocation_receipt_digest":"c1217dff9741b25775d0207abe33ba6fc88d7bc8133d939ae9de38ebcc4d0b2c","allocator_config_digest":"b3c1b4493556d93773df5f4302fd7daa127755c782273d6041c413ed08ecac80","available_cost":0.0,"case_ids":["EQ-F01-DEV-01","EQ-F02-DEV-01","EQ-F01-DEV-02","EQ-F02-DEV-02"],"code_commit":"3f337a4de214bfee705655ace1391df68e6c4010","command_digest":"cad9be2aa9a8df3e2bc88ebcce8e8f47c416275aee7a8ccffbd0786e76a59994","corpus_digest":"ff509d989d9b2de1602528fc2b8c6a8d857786cc8b2c0c98456975c433c3ff61","dirty_state":true,"disposition":"valid","evaluation_config_digest":"7d21a0d37223a60e519d756c568b24915126e66e3581531c61331f7d1d3b1395","evaluation_core":{"allocation_receipt":{"digest":"c1217dff9741b25775d0207abe33ba6fc88d7bc8133d939ae9de38ebcc4d0b2c","name":"allocation_receipt"},"allocator_model_config":{"digest":"4e96c60e592bb153e25eab107f4f378cfbc7239daa7f9d1f5139cfe78baf3feb","name":"allocator_model_config"},"allocator_prompt":{"digest":"91b97da754357e921fbd3f3226b9ca36d058f2e30847505da2c3eb5de59a1049","name":"allocator_prompt"},"canonical_scorer":{"digest":"b68d442eea12683c7c1ad8460b6069965b719e9dd2f329c18e36edc80eff3ff4","name":"canonical_scorer"},"corpus_manifest":{"digest":"9d29147bc72ceacb79569e5961cedefb0b8238e2d2ead188115d5aed0c2113e4","name":"corpus_manifest"},"evaluation_config":{"digest":"7d21a0d37223a60e519d756c568b24915126e66e3581531c61331f7d1d3b1395","name":"evaluation_config"},"evidence_validation_manifest":{"digest":"530ad8d87ed937e97183efbb963a68af72a87059d82835627848b58cf8754a77","name":"evidence_validation_manifest"},"feature_version":{"digest":"5143d20c9cf438e26c946b0f81012c169c3d36f595a902374303ed753991085c","name":"feature_version"},"initial_evaluation_snapshot":{"digest":"3f7215cd5f61c976620f6718ed6255c81d9b981affa9e88fc5aa38f970e60d29","name":"initial_evaluation_snapshot"},"optional_absences":[],"ranker_case_bundle":{"digest":"4bffd7707bf52360169ab6507cd5f93f578ca5fed78fdd3e3889c76d0ee80a54","name":"ranker_case_bundle"},"ranking_policy":{"digest":"f7df706f20c53c30b089b0bb9ae9b037d3d6f1aa7c8f9061a0fd173ee9860361","name":"ranking_policy"},"raw_run_outputs":{"digest":"7a0744c84021d82413e110b771252143ba1c89dc7967fe374cd0aaa92160b656","name":"raw_run_outputs"},"review_queue":{"digest":"f1457ed0aa192b0636f4d36710c6b797b5b75375663903345259847fd7f85115","name":"review_queue"},"risk_findings":{"digest":"0889cecfcffc089042f27f714e489efea17f7cadb8b478e48d51885142a961dc","name":"risk_findings"},"rubric_snapshot":{"digest":"d488bd89138edb7d3e4ccca6913f2743b60cac1ec4328e1db061c9bb7744f08c","name":"rubric_snapshot"},"runtime_dependency_manifest":{"digest":"2a362e90f395355d1aa9c064a12279b748f3fb5fead7a482e4cb129b2b0e716d","name":"runtime_dependency_manifest"},"scorer_reference_manifest":{"digest":"6735f01a4b5f9d10c1188fccb2714ee786e36406a755b3ba871448e0548c56f9","name":"scorer_reference_manifest"},"split_manifest":{"digest":"a43cedc7f9e624ace87741ad89b555494481b50f99f43a51aabf9e8c7862bce7","name":"split_manifest"}},"evaluation_run_id":"judge-fixture-run-v1","exit_code":0,"git_tree":"c42c2a10bad275d1689ee38bfaa22950032290ce","raw_artifact_refs":["ranker-cases.jsonl","scorer-cases.jsonl"],"request_count":0,"review_budget":1,"review_queue":["EQ-F01-DEV-01"],"runtime_seconds":0.013609250076115131,"schema_version":"1.0","scorer_version":"1.0","split_digest":"e0531d96c0a8b8d96233f4dcac9ce9b3383db87d0d9ac101c746b766dfc8b46a","tested_working_tree_digest":"941ee85cde2fe6b1883ad671b5b21cc3f32d25e28a49643a56e48d7d7c961239","token_count":0}